{
  "test_case_id": "TC-029",
  "title": "Adverse Event Summary Table by SOC, PT, and Severity",
  "parameters": {
    "seed": 42,
    "n_subjects": 200
  },
  "population": {
    "description": "Safety population (SAFFL = 'Y')",
    "n_experimental": 100,
    "n_control": 100
  },
  "severity_grades": [
    1,
    2,
    3,
    4,
    5
  ],
  "severity_summary": [
    {
      "grade": 1,
      "n_experimental": 100,
      "pct_experimental": 100.0,
      "n_control": 100,
      "pct_control": 100.0
    },
    {
      "grade": 2,
      "n_experimental": 100,
      "pct_experimental": 100.0,
      "n_control": 100,
      "pct_control": 100.0
    },
    {
      "grade": 3,
      "n_experimental": 100,
      "pct_experimental": 100.0,
      "n_control": 100,
      "pct_control": 100.0
    },
    {
      "grade": 4,
      "n_experimental": 100,
      "pct_experimental": 100.0,
      "n_control": 100,
      "pct_control": 100.0
    },
    {
      "grade": 5,
      "n_experimental": 99,
      "pct_experimental": 99.0,
      "n_control": 99,
      "pct_control": 99.0
    }
  ],
  "summary": [
    {
      "category": "Any adverse event",
      "n_experimental": 100,
      "pct_experimental": 100.0,
      "n_control": 100,
      "pct_control": 100.0
    },
    {
      "category": "Serious adverse events",
      "n_experimental": 100,
      "pct_experimental": 100.0,
      "n_control": 100,
      "pct_control": 100.0
    },
    {
      "category": "AEs leading to discontinuation",
      "n_experimental": 100,
      "pct_experimental": 100.0,
      "n_control": 100,
      "pct_control": 100.0
    }
  ],
  "ae_table": [
    {
      "category": "soc",
      "soc": "Gastrointestinal disorders",
      "pt": null,
      "severity": null,
      "n_experimental": 100,
      "n_control": 100,
      "pct_experimental": 100.0,
      "pct_control": 100.0
    },
    {
      "category": "soc_severity",
      "soc": "Gastrointestinal disorders",
      "pt": null,
      "severity": 1,
      "n_experimental": 100,
      "pct_experimental": 100.0,
      "n_control": 100,
      "pct_control": 100.0
    },
    {
      "category": "soc_severity",
      "soc": "Gastrointestinal disorders",
      "pt": null,
      "severity": 2,
      "n_experimental": 100,
      "pct_experimental": 100.0,
      "n_control": 100,
      "pct_control": 100.0
    },
    {
      "category": "soc_severity",
      "soc": "Gastrointestinal disorders",
      "pt": null,
      "severity": 3,
      "n_experimental": 100,
      "pct_experimental": 100.0,
      "n_control": 100,
      "pct_control": 100.0
    },
    {
      "category": "soc_severity",
      "soc": "Gastrointestinal disorders",
      "pt": null,
      "severity": 4,
      "n_experimental": 100,
      "pct_experimental": 100.0,
      "n_control": 92,
      "pct_control": 92.0
    },
    {
      "category": "soc_severity",
      "soc": "Gastrointestinal disorders",
      "pt": null,
      "severity": 5,
      "n_experimental": 64,
      "pct_experimental": 64.0,
      "n_control": 58,
      "pct_control": 58.0
    },
    {
      "category": "pt",
      "soc": "Gastrointestinal disorders",
      "pt": "Nausea",
      "severity": null,
      "n_experimental": 100,
      "pct_experimental": 100.0,
      "n_control": 100,
      "pct_control": 100.0
    },
    {
      "category": "pt_severity",
      "soc": "Gastrointestinal disorders",
      "pt": "Nausea",
      "severity": 1,
      "n_experimental": 100,
      "pct_experimental": 100.0,
      "n_control": 100,
      "pct_control": 100.0
    },
    {
      "category": "pt_severity",
      "soc": "Gastrointestinal disorders",
      "pt": "Nausea",
      "severity": 2,
      "n_experimental": 100,
      "pct_experimental": 100.0,
      "n_control": 98,
      "pct_control": 98.0
    },
    {
      "category": "pt_severity",
      "soc": "Gastrointestinal disorders",
      "pt": "Nausea",
      "severity": 3,
      "n_experimental": 93,
      "pct_experimental": 93.0,
      "n_control": 87,
      "pct_control": 87.0
    },
    {
      "category": "pt_severity",
      "soc": "Gastrointestinal disorders",
      "pt": "Nausea",
      "severity": 4,
      "n_experimental": 52,
      "pct_experimental": 52.0,
      "n_control": 35,
      "pct_control": 35.0
    },
    {
      "category": "pt_severity",
      "soc": "Gastrointestinal disorders",
      "pt": "Nausea",
      "severity": 5,
      "n_experimental": 17,
      "pct_experimental": 17.0,
      "n_control": 12,
      "pct_control": 12.0
    },
    {
      "category": "pt",
      "soc": "Gastrointestinal disorders",
      "pt": "Diarrhoea",
      "severity": null,
      "n_experimental": 100,
      "pct_experimental": 100.0,
      "n_control": 100,
      "pct_control": 100.0
    },
    {
      "category": "pt_severity",
      "soc": "Gastrointestinal disorders",
      "pt": "Diarrhoea",
      "severity": 1,
      "n_experimental": 100,
      "pct_experimental": 100.0,
      "n_control": 100,
      "pct_control": 100.0
    },
    {
      "category": "pt_severity",
      "soc": "Gastrointestinal disorders",
      "pt": "Diarrhoea",
      "severity": 2,
      "n_experimental": 98,
      "pct_experimental": 98.0,
      "n_control": 99,
      "pct_control": 99.0
    },
    {
      "category": "pt_severity",
      "soc": "Gastrointestinal disorders",
      "pt": "Diarrhoea",
      "severity": 3,
      "n_experimental": 95,
      "pct_experimental": 95.0,
      "n_control": 88,
      "pct_control": 88.0
    },
    {
      "category": "pt_severity",
      "soc": "Gastrointestinal disorders",
      "pt": "Diarrhoea",
      "severity": 4,
      "n_experimental": 44,
      "pct_experimental": 44.0,
      "n_control": 40,
      "pct_control": 40.0
    },
    {
      "category": "pt_severity",
      "soc": "Gastrointestinal disorders",
      "pt": "Diarrhoea",
      "severity": 5,
      "n_experimental": 13,
      "pct_experimental": 13.0,
      "n_control": 11,
      "pct_control": 11.0
    },
    {
      "category": "pt",
      "soc": "Gastrointestinal disorders",
      "pt": "Vomiting",
      "severity": null,
      "n_experimental": 100,
      "pct_experimental": 100.0,
      "n_control": 100,
      "pct_control": 100.0
    },
    {
      "category": "pt_severity",
      "soc": "Gastrointestinal disorders",
      "pt": "Vomiting",
      "severity": 1,
      "n_experimental": 100,
      "pct_experimental": 100.0,
      "n_control": 100,
      "pct_control": 100.0
    },
    {
      "category": "pt_severity",
      "soc": "Gastrointestinal disorders",
      "pt": "Vomiting",
      "severity": 2,
      "n_experimental": 100,
      "pct_experimental": 100.0,
      "n_control": 99,
      "pct_control": 99.0
    },
    {
      "category": "pt_severity",
      "soc": "Gastrointestinal disorders",
      "pt": "Vomiting",
      "severity": 3,
      "n_experimental": 91,
      "pct_experimental": 91.0,
      "n_control": 85,
      "pct_control": 85.0
    },
    {
      "category": "pt_severity",
      "soc": "Gastrointestinal disorders",
      "pt": "Vomiting",
      "severity": 4,
      "n_experimental": 54,
      "pct_experimental": 54.0,
      "n_control": 35,
      "pct_control": 35.0
    },
    {
      "category": "pt_severity",
      "soc": "Gastrointestinal disorders",
      "pt": "Vomiting",
      "severity": 5,
      "n_experimental": 14,
      "pct_experimental": 14.0,
      "n_control": 11,
      "pct_control": 11.0
    },
    {
      "category": "pt",
      "soc": "Gastrointestinal disorders",
      "pt": "Abdominal pain",
      "severity": null,
      "n_experimental": 100,
      "pct_experimental": 100.0,
      "n_control": 100,
      "pct_control": 100.0
    },
    {
      "category": "pt_severity",
      "soc": "Gastrointestinal disorders",
      "pt": "Abdominal pain",
      "severity": 1,
      "n_experimental": 100,
      "pct_experimental": 100.0,
      "n_control": 100,
      "pct_control": 100.0
    },
    {
      "category": "pt_severity",
      "soc": "Gastrointestinal disorders",
      "pt": "Abdominal pain",
      "severity": 2,
      "n_experimental": 100,
      "pct_experimental": 100.0,
      "n_control": 94,
      "pct_control": 94.0
    },
    {
      "category": "pt_severity",
      "soc": "Gastrointestinal disorders",
      "pt": "Abdominal pain",
      "severity": 3,
      "n_experimental": 95,
      "pct_experimental": 95.0,
      "n_control": 84,
      "pct_control": 84.0
    },
    {
      "category": "pt_severity",
      "soc": "Gastrointestinal disorders",
      "pt": "Abdominal pain",
      "severity": 4,
      "n_experimental": 53,
      "pct_experimental": 53.0,
      "n_control": 38,
      "pct_control": 38.0
    },
    {
      "category": "pt_severity",
      "soc": "Gastrointestinal disorders",
      "pt": "Abdominal pain",
      "severity": 5,
      "n_experimental": 27,
      "pct_experimental": 27.0,
      "n_control": 14,
      "pct_control": 14.0
    },
    {
      "category": "pt",
      "soc": "Gastrointestinal disorders",
      "pt": "Constipation",
      "severity": null,
      "n_experimental": 100,
      "pct_experimental": 100.0,
      "n_control": 100,
      "pct_control": 100.0
    },
    {
      "category": "pt_severity",
      "soc": "Gastrointestinal disorders",
      "pt": "Constipation",
      "severity": 1,
      "n_experimental": 100,
      "pct_experimental": 100.0,
      "n_control": 100,
      "pct_control": 100.0
    },
    {
      "category": "pt_severity",
      "soc": "Gastrointestinal disorders",
      "pt": "Constipation",
      "severity": 2,
      "n_experimental": 100,
      "pct_experimental": 100.0,
      "n_control": 100,
      "pct_control": 100.0
    },
    {
      "category": "pt_severity",
      "soc": "Gastrointestinal disorders",
      "pt": "Constipation",
      "severity": 3,
      "n_experimental": 97,
      "pct_experimental": 97.0,
      "n_control": 89,
      "pct_control": 89.0
    },
    {
      "category": "pt_severity",